{
  "$schema": "http://json-schema.org/draft-07/schema#",
  "title": "Issue Status Schema",
  "type": "object",
  "required": ["schema_version", "statuses", "rules"],
  "properties": {
    "schema_version": {"type": "string", "const": "1"},
    "description": {"type": "string"},
    "statuses": {"type": "object"},
    "rules": {"type": "object"}
  }
}
